document,topic,gamma,document_number,year,StoreId,Title,Abstract,subjectTerms
153,4,0.998924539188287,153,2016,1823531019,"Going Out Guide for Maryland, Sept. 2-28, 2016 (Posted 2016-09-22 15:50:25)","  Song of the Goat Theatre The Polish theater company performs ""Songs of Lear,"" a song cycle inspired by Shakespeare's ""King Lear"" that took top honors at the 2012 Edinburgh Fringe Festival. TUE 27 ""Hands Up, Don't Shoot! A Conversation About Race, Policing and Protesting in America"" A screening of the film ""Fruitvale Station,"" followed by a discussion about racism, mass shootings and police brutality. 2-4:30 p.m. Prince George's Community College, Rennie Forum, 301 Largo Rd., Largo. 301-546-7422. pgcc.libguides.com.","Colleges & universities , Age , Musical performances , Painting , Militia groups"
926,4,0.9988952276811971,926,2016,1835884876,"OBITUARIES; JAMES GALANOS, 1924 - 2016; Designer to the stars kept low profile",NA,NA
10566,4,0.9988843715044112,10566,2017,1968155909,"Avenue of freaks, neon and history",NA,"Neon , Hotels & motels , Museums , Homeless people , Colorado , Kerouac, Jack , New York , United States--US , Ginsberg, Allen , San Francisco California , Kansas , Utah"
917,4,0.9988069790657229,917,2016,1835484554,"Prince William County community calendar, Nov. 3-9, 2016","  ""The Migration Project (Push/Pull)"" This art installation and performance presented by Jane Franklin Dance delves into different perspectives of immigration and features a sculptural representation of relocation by visual artist Rosemary Feit Covey. SAT 05 Lucketts Bluegrass Music by the Scott Brannon Band.","Theater , Parks & recreation areas , Bluegrass music , Visual artists , Art exhibits , Orchestras"
1653,4,0.9988069706104931,1653,2016,1843006870,"AT THE MOVIES; REVIEW; Evoking the past yet looking forward; Powerful 'Daughters of the Dust' from 1991 immerses viewers in a different time, place.","  Rather than telling her story via clean, linear strokes and manufactured crises, Dash lingers on the sights and sounds of Sea Island life, from the unforgettable images of women on the beach in floor-length white dresses to the close-ups of fresh-cooked prawns, hard-boiled eggs and other dishes served at the Peazants' feast.",Motion picture festivals
12988,4,0.9987943020745172,12988,2018,2017346516,"FOOD &amp;amp; DINING; One simply divine meal; Profits from Lotus Vegetarian Restaurant go to the Buddhist Foundation, and monks and nuns run the kitchen.",NA,"Rice , Gardens & gardening , Chefs , Recipes , Photographers , Buddhism , Monks , Vegetarianism , Restaurants , Los Angeles California , United States--US , Vietnam"
11611,4,0.9986636781754502,11611,2018,1989166675,"ARCHITECTURE SPOTLIGHT: TUDOR REVIVAL; Dream factory's European fantasy; Style's popularity in SoCal peaked in the '20s, a time of escapism and whimsy.",NA,"Architecture , Houses , Photographers"
15826,4,0.9986045432875156,15826,2017,1875364701,Calendar of Events,"FRI 10 Spring art show The Color &amp; Light Society of Southern Maryland hosts this Annmarie After Hours event featuring multimedia artworks from its members. 5-8 p.m. Annmarie Sculpture Garden &amp; Arts Center, 13480 Dowell Rd., Dowell. 410-326-4640. colorandlightsociety.org. $5. ""The 25th Annual Putnam County Spelling Bee"" A staging of the Tony-winning comedy about a quirky group of students competing in a spelling bee. 8 p.m. Through March 25. ""Ulysses Marshall: The Spirit Within"" The...","Spelling bees , Art exhibits , Solomons Island"
3772,4,0.9985941775145073,3772,2017,1865312799,"Pho Recipes That Think Outside the Bowl; You may know Vietnam's national dish as a beefy noodle soup, but why stop there? With riffs on the recipe ranging from dumplings to burritos to cocktails, it's time to expand your pho-rizons",NA,"Beef , Recipes , Los Angeles California , San Clemente California , United States--US , Vietnam"
3520,4,0.998590686002482,3520,2017,1863920868,"Pho Recipes That Think Outside the Bowl; You may know Vietnam's national dish as a beefy noodle soup, but why stop there? With riffs on the recipe ranging from dumplings to burritos to cocktails, it's time to expand your pho-rizons",NA,"Beef , Recipes , Los Angeles California , San Clemente California , United States--US , Vietnam"
14860,5,0.999311043644347,14860,2017,1866464008,"Court Deals Fresh Blow to Trump --- In unanimous ruling, judges say president's travel ban should remain suspended","  ""The government has not shown that the executive order provides what due process requires, such as notice and a hearing prior to restricting an individual's ability to travel,"" a three-judge panel of the U.S. Court of Appeals for the Ninth Circuit in San Francisco found.","Federal court decisions , Presidents , Travel , United States--US , Trump, Donald J"
10969,5,0.9992831856660156,10969,2017,1979417760,"Congress approves stopgap measure, evading shutdown",NA,"Federal funding , Disaster relief , Legislation , Waivers , Budgets , Medicare , Defense , National security , Bills , Leadership , Immigration , Congressional committees"
11453,5,0.9992103803512692,11453,2018,1987612751,Risk of shutdown rises over mistrust,NA,"Federal employees , Presidents , Budgets , Health care policy , Bills , Funding , Short term , Shutdowns , Aliens , Legislators , Immigration , Trump, Donald J"
3851,5,0.999158879162416,3851,2017,1865656278,Court Grills Lawyers on Donald Trump's Immigration Order; Judges fired tough questions at both sides in hearing over Trump's travel ban; ruling expected within days,NA,"Court hearings & proceedings , Federal court decisions , Aliens , State court decisions , Trump, Donald J , Minnesota"
12297,5,0.9991371356368937,12297,2018,2002095664,Bipartisan immigration proposal emerges from Senate,NA,"Presidents , Immigration policy , Bills , Border security , Legislation , Corporate sponsorship , Leadership , Aliens , Rounds, Mike , Trump, Donald J , Toomey, Patrick J , McCain, John , Maine , Manchin, Joe , Schumer, Charles E , Grassley, Charles E , McConnell, Mitch , King, Angus S, Jr , Mexico , United States--US , New York , California , Durbin, Richard J , Iowa , Kaine, Tim"
12324,5,0.9991345017688614,12324,2018,2002374642,Relief for 'dreamers' no nearer as bills fail,NA,"Presidents , Immigration policy , National security , Bills , Aliens , Deportation , Political leadership , Citizenship , Trump, Donald J , Mexico , United States--US"
11786,5,0.9990900960777638,11786,2018,1990645033,Donald Trump Backs Citizenship Pathway for Dreamers; Comments made to reporters are in line with bipartisan senate group and are latest in a series of shifting statements by president on immigration policy,NA,"Immigration policy , Deportation , Funding , Legislators , Border security , Citizenship , Presidents , Legislation , Aliens , Sanders, Sarah Huckabee , South Carolina , Trump, Donald J , Texas , United States--US , Maine , Cornyn, John , Graham, Lindsey , McConnell, Mitch , McCaskill, Claire"
12515,5,0.9990856921922638,12515,2018,2008206569,Justices decline to hear case on DACA,NA,"Presidents , Immigration policy , Injunctions , Legislators , Federal court decisions , Aliens , Deportation , Citizenship , Judges & magistrates , Trump, Donald J , Cornyn, John , Grassley, Charles E , United States--US , Becerra, Xavier , Biden, Joseph R Jr , Durbin, Richard J , Goodlatte, Bob"
3842,5,0.9990692019597951,3842,2017,1865625832,Donald Trump's Immigration Action in Court's Hands; Appeals panel to hear oral arguments on reinstating travel ban; decision is expected later this week,NA,"Supreme Court decisions , Presidents , Attorneys , National security , Federal court decisions , Immigration , Congressional committees , Trump, Donald J , California , United States--US , Syria , San Francisco California"
7481,5,0.9990489141989607,7481,2017,1902168723,Appeals Court Rules Against Trump's Revised Travel Ban; Administration says it will appeal to Supreme Court,NA,"Muslims , Political campaigns , Travel , Presidents , Executive orders , Federal court decisions , State court decisions , Immigration , Sudan , Trump, Donald J , Somalia , United States--US , Libya , Iran , Maryland , Yemen , Syria , Giuliani, Rudolph W"
14914,5,0.9990310547755727,14914,2017,1867259435,Trump might rewrite travel ban,"Move may restore some elements Supreme Court fight still on table, officials say President Trump said Friday that he is considering rewriting his executive order temporarily barring refugees and citizens of seven Muslim-majority countries from entering the country, indicating that the administration may try to quickly restore some aspects of the now-frozen travel ban or replace it with other measures. A three-judge panel of the U.S. Court of Appeals for the 9th Circuit ruled unanimously Thursday that Trump's travel ban should remain suspended, allowing people previously barred to continue entering the United States. The 9th Circuit judges also rejected the Justice Department's request to narrow a lower-court judge's freeze of the ban, saying that even if that freeze was too broad, it is ""not our role to try, in effect, to rewrite the Executive Order."" Justice Department lawyers also argued that the ban no longer applied to green-card holders - citing guidance from the White House counsel issued after the ban took effect - and that challenges on those grounds should thus be invalidated. ""The White House counsel is not the President, and he is not known to be in the chain of command for any of the Executive Departments,"" the judges wrote. [...]in light of the Government's shifting interpretations of the Executive Order, we cannot say that the current interpretation by White House counsel, even if authoritative and binding, will persist past the immediate stage of these proceedings.""","Social networks , Immigration policy , Evidence , Presidents , Court hearings & proceedings , Executive orders , National security , Attorneys , Federal court decisions , State court decisions , Priebus, Reince , United States--US , Sessions, Jeff , Trump, Donald J"
14857,5,0.9990277417029838,14857,2017,1866463997,U.S. News: Court Asserts Its Role in Review of President Order,"  While the court seemed to warm to the states' due process claims in its unanimous, 29-page opinion, the three-judge panel made a point of deferring its decision on the ""serious allegations"" of religious discrimination until later in the case. While the court seemed to warm to the states' due process claims in its unanimous, 29-page opinion, the three-judge panel made a point of deferring its decision on the ""serious allegations"" of religious discrimination until later in the case.","Constitutional law , Federal court decisions , National security , Executive orders , United States--US"
12322,5,0.9990260693010035,12322,2018,2002370808,Immigration Measures Fail in Senate; Fate of Dreamers remains unaddressed ahead of March deadline,NA,"Funding , Citizenship , Presidents , Short term , Immigration policy , National security , Bills , Legislators , Border security , Aliens , Rounds, Mike , Trump, Donald J , Maine , Cornyn, John , Flake, Jeff , King, Angus S, Jr , Texas , United States--US , Coons, Chris , Graham, Lindsey , Goodlatte, Bob , Rubio, Marco"
11575,5,0.9990193358160164,11575,2018,1988808322,"Government shutdown looks like a possibility; Short-term spending bill passes in House, but Senate Democrats object because it lacks a deal on 'Dreamers.'",NA,"Immigration policy , Federal employees , Presidents , Deportation , Childrens health insurance programs , Bills , Leadership , Funding , Short term , Shutdowns , Aliens"
10865,5,0.9990090526616799,10865,2017,1977119595,Funding bill pushed by House GOP sets up showdown,NA,"Agreements , Immigration policy , Federal budget , Veterans , Bills , Funding , Legislators , Legislation , Defense , Leadership , Aliens , Narcotics , Pelosi, Nancy , Frelinghuysen, Rodney P"
5523,5,0.9989896458461868,5523,2017,1881999771,GOP foresees avoiding a government shutdown,NA,"Agreements , Federal budget , Defense , Bills , Leadership , Border patrol , Border security , Mexico , McConnell, Mitch , Blunt, Roy D"
3971,5,0.998986032662373,3971,2017,1866383294,Appeals Court Rules Against Trump Travel Ban; Judges say temporary halt on executive order should continue,NA,"Immigration policy , National security , Muslims , Politics , Supreme Court decisions , Court hearings & proceedings , Presidents , Executive orders , Federal court decisions , State court decisions , Trump, Donald J , United States--US , Minnesota , Syria , San Francisco California"
12150,5,0.9989842198111678,12150,2018,1999049779,Congress closes in on long-term budget deal; Senate leaders agree to a two-year pact that would end shutdown threats. But obstacles remain.,NA,"Immigration policy , Deportation , Bills , Aliens , Apportionment , Federal budget , Political leadership , Government spending , Federal legislation , Federal funding , Speeches , Shutdowns , Trump, Donald J , United States--US , Pelosi, Nancy , Schumer, Charles E , California , McConnell, Mitch"
12317,5,0.9989824063778403,12317,2018,2002228616,Immigration Measures Fail in Senate; Fate of Dreamers remains unaddressed ahead of March deadline,NA,"Immigration policy , National security , Bills , Funding , Legislators , Border security , Citizenship , Presidents , Rounds, Mike , Trump, Donald J , Maine , Coons, Chris , Lankford, James , Grassley, Charles E , Flake, Jeff , King, Angus S, Jr , Iowa"
5491,5,0.9989805721015204,5491,2017,1881549632,Russia Investigation Stalls in House; Lawmakers have called for GOP chairman to step aside,NA,"Intelligence gathering , Committees , Testimony , Presidents , Attorneys general , Scandals , Verbal communication , Trump, Donald J , Swalwell, Eric , California , United States--US"
3969,5,0.9989768918929648,3969,2017,1866379497,Appeals Court Rules Against Trump Travel Ban; Judges say temporary halt on executive order should continue,NA,"Presidents , Executive orders , National security , Federal court decisions , Immigration , State court decisions , Trump, Donald J , Syria , United States--US"
10964,5,0.9989465102390565,10964,2017,1979368098,Congress Passes Short-Term Spending Bill to Avoid Government Shutdown; Republicans' plan to keep government funded through Jan. 19 pushes thorny budget fight into next year,NA,"Children & youth , Federal budget , Surveillance , Health insurance , Childrens health insurance programs , Bills , Short term , Legislators , Immigration , Trump, Donald J"
12195,5,0.9989465058242071,12195,2018,1999885416,LIGHTS OFF AND ON FOR FEDERAL AGENCIES; A brief government shutdown ends when parties work through the night for a rare spending agreement.,NA,"Photographs , Federal budget , Political parties , Childrens health insurance programs , Primaries & caucuses , Immigration policy , Deportation , Photographers , Bills , Legislators , Social networks , Disaster relief , Aliens , Trump, Donald J , Puerto Rico , Schumer, Charles E , Grijalva, Raul M , McConnell, Mitch , San Francisco California , Paul, Rand , Obama, Barack , United States--US , Western states , Pelosi, Nancy , Graham, Lindsey , Durbin, Richard J , Kelly, John F"
14879,5,0.9989445513703983,14879,2017,1867098919,Trump might rewrite travel ban,"Move may restore some elements Supreme Court fight still on table, officials say President Trump said Friday that he is considering rewriting his executive order temporarily barring refugees and citizens of seven Muslim-majority countries from entering the country, indicating that the administration may try to quickly restore some aspects of the now-frozen travel ban or replace it with other measures. A three-judge panel of the U.S. Court of Appeals for the 9th Circuit ruled unanimously Thursday that Trump's travel ban should remain suspended, allowing people previously barred to continue entering the United States. The 9th Circuit judges also rejected the Justice Department's request to narrow a lower-court judge's freeze of the ban, saying that even if that freeze was too broad, it is ""not our role to try, in effect, to rewrite the Executive Order."" Justice Department lawyers also argued that the ban no longer applied to green-card holders - citing guidance from the White House counsel issued after the ban took effect - and that challenges on those grounds should thus be invalidated. ""The White House counsel is not the President, and he is not known to be in the chain of command for any of the Executive Departments,""...","Social networks , Immigration policy , Evidence , Presidents , Court hearings & proceedings , Executive orders , National security , Federal court decisions , State court decisions , Priebus, Reince , United States--US , Sessions, Jeff , Trump, Donald J"
10756,5,0.9989445463768494,10756,2017,1973678131,"Shutdown is averted for now, but the fight is not over",NA,"Presidents , Federal budget , Defense , Bills , Funding , Short term , Aliens , Immigration , United States--US"
9203,5,0.998930628996454,9203,2017,1936103878,"Trump Makes Deal on Debt, Irking GOP",NA,"Government aid , Hurricanes , Budget deficits , Political parties , Trump, Donald J"
12333,5,0.9989245301672885,12333,2018,2002382836,"BORDER REFORM MEASURE FAILS IN SENATE; Trump had threatened to veto the bipartisan effort, which promised to protect 'Dreamers' and pay for security.",NA,"Presidents , Immigration policy , Deportation , Bills , Border security , Aliens , Political leadership , Reforms , Trump, Donald J , United States--US"
10975,5,0.9989183992760652,10975,2017,1979431547,Congress Avoids Shutdown --- Stopgap measure to fund government into January passes House and Senate,NA,"Childrens health insurance programs , Federal budget , Budget deficits , Shutdowns , Trump, Donald J"
5134,5,0.9989100937635598,5134,2017,1877625124,"Hawaii Judge Blocks Trump's Revised Travel Ban; In issuing nationwide restraining order, judge rules challengers likely to prove president's directive is unconstitutional","The original order, which produced chaos around the country , barred travel from Iraq as well as the other six countries and applied to a broader class of people, including visa holders and green-card recipients, who previously had permission to be in the U.S. Courts in the first round of litigation said the original order raised major due process concerns because it didn't give people advance notice of the policy or allow them the chance to argue that they should be allowed to travel. The White House took several steps in its revised order to address those due process concerns, and as a result the latest legal fight has focused on whether the travel ban violated the Constitution's Establishment Clause, which prohibits the government from disfavoring particular religions. The appeal would go back to the Ninth U.S. Circuit Court of Appeals , the same court that dealt the final blow to Mr. Trump's original executive order. Refugee-assistance groups and others, represented by the American Civil Liberties Union, brought the Maryland case, saying immigrants and refugees would face immediate harm if the executive order was allowed to go live. Adding new national-security language to the order ""doesn't divorce it from its...","Federal court decisions , Trump, Donald J , Hawaii , United States--US"
12143,5,0.9989037778327692,12143,2018,1995331819,Congressional Leaders Say They Agree on Budget Deal; Two-year pact raises federal spending by almost $300 billion above limits imposed by a 2011 budget law,NA,"Immigration policy , Federal budget , Appropriations , Bills , Leadership , Trump, Donald J , Wisconsin , Pelosi, Nancy , Gallego, Ruben , California , McConnell, Mitch , Ryan, Paul"
4902,6,0.9902590886573447,4902,2016,1823527424,Donald Trump's raging egomania (Posted 2016-09-08 23:25:00),"  The candidates appeared sequentially, not face to face, at the USS Intrepid museum in New York before an audience of military service members and veterans. The old aircraft carrier, commissioned during World War II and retired after Vietnam, was an apt setting for hearing the candidates' positions on foreign and defense policy.","Armed forces , Political campaigns , Leadership , Presidential elections , United States--US , Syria , Clinton, Hillary"
4903,6,0.9902590886573447,4903,2016,1823527733,Donald Trump's raging egomania (Posted 2016-09-08 23:25:19),"  The candidates appeared sequentially, not face to face, at the USS Intrepid museum in New York before an audience of military service members and veterans. The old aircraft carrier, commissioned during World War II and retired after Vietnam, was an apt setting for hearing the candidates' positions on foreign and defense policy.","Armed forces , Political campaigns , Leadership , Presidential elections , United States--US , Syria , Clinton, Hillary"
116,6,0.9902093251425298,116,2016,1821630080,2 Ex-Spies and Donald Trump,"  [...]Trump has told so many baldfaced lies in the last year, I can't imagine what would happen if he had to take America into a war.","Presidential elections , National security , Candidates , Political campaigns , United States--US , Russia , Gates, Robert M , Putin, Vladimir , Trump, Donald J"
10785,6,0.9901881934596256,10785,2017,1974680278,"In two memoirs, same election but different worlds",NA,"Primaries & caucuses , Books , Political parties , Russia , United States--US , Fahrenthold, David , Trump, Donald J"
6117,6,0.9856875373252191,6117,2018,2061744326,Numbers and letters,NA,"Mexico , United States--US"
470,6,0.9853501772002382,470,2016,1827230458,"In second debate, Trump takes fight to moderators, too","  Donald Trump took on the two moderators of Sunday's presidential debate almost as avidly as he assailed his opponent Hillary Clinton, repeatedly needling them and at one point implicitly calling them unfair.","Armed forces , Audiences , Sex crimes , Debates"
481,6,0.9853501772002382,481,2016,1827432420,"In debate, Trump takes on moderators almost as much as Clinton (Posted 2016-10-10 03:48:37)","  Donald Trump took on the two moderators of Sunday's presidential debate almost as avidly as he assailed his opponent Hillary Clinton, repeatedly needling them and at one point implicitly calling them unfair.","Armed forces , Audiences , Sex crimes , Debates"
6704,6,0.9817193068454503,6704,2018,2074030018,I worked to defeat Obama. I'd gladly take him back,NA,"Political campaigns , Presidents , Foreign policy , Trump, Donald J , Romney, W Mitt , North Korea , Lincoln, Abraham (1809-65) , Russia , United States--US , South Africa , McCain, John , Kenya , Israel , Mandela, Nelson , Iraq , Iran , Syria , Putin, Vladimir , Obama, Barack"
8374,6,0.9805200747754209,8374,2017,1922260506,"Trump's presidency, Huntington's America",NA,"National identity , Presidents , Democracy , Books , Politics , Civilization , Immigration , United States--US"
13797,6,0.9768954329768872,13797,2018,2036043082,Of Persons And Peoples,NA,"Books , Loeffler, James"
13787,6,0.9763468529173067,13787,2018,2035863449,"'Rooted Cosmopolitans' Review: Of Persons and Peoples; It is no surprise that 20th-century Jews, who until the creation of Israel had no state dedicated to their interests, were the fathers of human rights. Martin Peretz reviews ""Rooted Cosmopolitans"" by James Loeffler.",NA,"Yiddish language , Minority & ethnic groups , Judaic studies , Philosophy , Human rights , Jews , Russia , Israel , Peretz, Martin , Germany , United Kingdom--UK , Argentina , China , Gold, Herbert , Wilson, Woodrow (1856-1924) , Arendt, Hannah , Morocco"
3554,6,0.9747982047581198,3554,2017,1864052534,Donald the Menace,"[...]it also reflected a cold view of the incentives the new administration would face: as working-class voters began to realize that candidate Trump's promises about jobs and health care were insincere, foreign distractions would look increasingly attractive. According to The Associated Press, he told our neighbor's democratically elected leader: ""You have a bunch of bad hombres down there. [...]this administration doesn't seem prepared on any front. Mr. Trump's confrontational phone calls, in particular, don't sound like the working out of an economic or even political strategy -- cunning schemers don't waste time boasting about their election victories and whining about media reports on crowd sizes.","Immigration policy , International relations-US , Foreign policy , Trump, Donald J , United States--US , Turnbull, Malcolm , Australia"
3691,6,0.9708796051467963,3691,2017,1864989603,"Regarding Putin, Trump Suggests U.S. Isn't 'So Innocent'","Mr. Trump's campaign pledge to mend ties with Moscow has raised questions over his administration's commitment to maintaining sanctions against Russia for its involvement in the fighting and annexation of Crimea from Ukraine. In another excerpt from the Fox interview, Mr. Trump was asked whether it was irresponsible for him to say that three million illegal immigrants voted in the election while lacking the evidence to support that assertion. President Trump Made the Comments in...","Presidents , Morality , International relations-US , Politics , Foreign policy , Russia , United States--US , Putin, Vladimir , Trump, Donald J"
13115,6,0.969039003553406,13115,2018,2020265674,Obama keeps silent despite Trump jabs,NA,"American history , Political campaigns , Presidents , Trump, Donald J , Russia , United States--US , Carter, Jimmy , Iran , Bush, George , Earnest, Josh , Thurber, James (1894-1961) , Clinton, Bill , Bush, George W , Obama, Barack"
