document,topic,gamma,document_number,year,StoreId,Title,Abstract,subjectTerms
1392,2,0.9985657417256953,1392,2016,1839486580,Tech Stocks Miss Out on Trump Bump --- Sector joins Tuesday's rise but is down 1.8% since Election Day; Dow at another record,"  Mr. Trump called out Apple Inc. on the campaign trail in February, for instance, saying consumers should boycott the company after Apple refused to help the U.S. government unlock a killer's iPhone. Daniel Morgan, senior portfolio manager at Synovus Trust Co., said Mr. Trump's immigration plans as president could affect visa programs, making it more difficult for engineering and other tech talent to work in the U.S. Trade limits also could hurt big technology companies that derive a large percentage of their revenues overseas, he said, particularly for companies with large cross-border commerce such as Facebook and Amazon.com.","Technology stocks , Financial performance , Dow Jones averages , Stock prices , Daily markets (wsj) , United States--US"
8326,2,0.9985547893162763,8326,2017,1919855177,Foreigners Pump Up Home Prices in U.S.,"In all, foreign buyers and recent immigrants purchased $153 billion of residential property in the U.S. in the year ended in March, nearly a 50% jump from a year earlier, according to a National Association of Realtors report released Tuesday. The number of homes on the market has fallen year-over-year for 24 consecutive months, according to the Realtors association, making the most-recent spring selling season one of the most competitive on record. In Florida they can get a detached single-family house in that price range, while in Canada even an 800-square-foot condo is roughly twice that much, he said. The median price for a home purchased by a foreigner was more than $300,000, compared with roughly $235,000 for all existing homes sold in the U.S., according to the National Association of Realtors.","Property values , Price increases , Foreign investments in the US , Real estate sales , Housing prices , United States--US"
9620,3,0.9992136567164032,9620,2017,1942135901,"Merkel Claims A Fourth Term, With Obstacles",NA,"Political leadership , Coalition governments , Parliaments , Populism , Immigration , Voter behavior , Political parties , Election results , Political power , Germany , Merkel, Angela"
7170,3,0.9991345038081401,7170,2017,1895805844,"For Europe's far-right forces, a reality check",NA,"Power , Political leadership , Politics , International relations , Presidential elections , Candidates , Populism , Aliens , Western Europe , Netherlands , United States--US , Germany , Hollande, Francois , Austria , France , Trump, Donald J"
5012,3,0.9990737543280871,5012,2017,1875986881,"Trump template resonates in N.J., Va.","The former ""Saturday Night Live"" cast member best known for his impersonation of Frank Sinatra is ""very close"" to jumping into the New Jersey governor's race, inspired in part by his interactions with ""real Americans"" while on the campaign trail with Trump. Piscopo's possible bid reflects the maneuvering in New Jersey and Virginia - the two states with gubernatorial contests this year - by candidates from both parties, who are trying to capitalize on lessons learned from Trump's strong performance among working-class voters. Several Democrats in New Jersey and Virginia have taken on the mantle of issues championed by Sanders, such as raising the minimum wage to $15, making public colleges and universities free, and moving to a single-payer health-care system. Despite sagging job approval numbers nationally, Trump remains popular among the Republican base, so there's an incentive, analysts say, to play up similarities during competitive GOP primaries. New Jersey Lt. Gov. Kim Guadagno (R), who is seeking to succeed Christie, made no mention of Trump during a forum here hosted by a commercial real estate development association. Murphy has hardly ceded the progressive label to his challengers, pushing several issues that were part of Sanders's platform, including a $15...","Primaries & caucuses , Clergy , Political campaigns , Political appointments , Presidential elections , Candidates , Populism , Political advertising , Immigration , Wisniewski, John S , New Jersey , Sinatra, Frank , Virginia , Vermont , Trump, Donald J"
6905,3,0.9989286010535778,6905,2017,1891315767,French voters have identity-defining choice to make in presidential runoff,NA,"National identity , Extremism , Speeches , Election results , Presidential elections , Candidates , Politics , Political movements , Hamon, Benoit , France , Europe"
7790,3,0.9988952341185109,7790,2017,1909352395,Virginia Gubernatorial Primary Shows Divisions in GOP; Results mirror Democratic turnout surge in recent elections across the country,NA,"Local elections , Election results , Governors , Congressional elections , Political advertising , Trump, Donald J , Kansas , New Jersey , Price, Tom , Ossoff, Jon , Virginia , Atlanta Georgia"
5113,3,0.9988434471887175,5113,2017,1877035026,"Dutch Leader Holds Off Populists, Exit Polls Suggest; Prime Minister Mark Rutte appears to have achieved goal of finishing ahead of anti-Islam firebrand Geert Wilders","Dutch Prime Minister Mark Rutte's center-right People's Party for Freedom and Democracy gained the most votes, putting Mr. Rutte in a strong position to form a new ruling coalition. Preliminary results, after 331 of the total of 388 polling stations counted the votes, put the premier's center-right party on track to win 32 seats, a 9-seat drop compared with 2012 but still ahead of Mr. Wilders's group, which was projected to tie for 19 seats with two other parties--the centrist D66 and the conservative Christian Democratic Alliance. Mr. Rutte late Wednesday held a victory speech to the cheers of a crowd gathered at The Hague's World Trade Center, saying his party's performance was a victory ""against the wrong sort of populism"" seen in the U.K. referendum to leave the European Union and the U.S. election. The outcome suggests that Dutch voters have elected a highly fragmented lower house of parliament,...","Election results , Presidential elections , Candidates , Populism , Aliens , Turkey , Netherlands , United States--US , United Kingdom--UK , Europe"
1102,3,0.9988267038895603,1102,2016,1837560675,"Donald Trump's Win Hailed by Europe's Populists as Proof of Anti-Establishment Momentum; A 'victory of freedom,' says National Front's Marine Le Pen",NA,NA
5139,3,0.9988044608264672,5139,2017,1877673206,Dutch Voters Rebuff Anti-Immigration Candidate; Prime Minister Mark Rutte achieved goal of finishing ahead of anti-Islam firebrand Geert Wilders,"Dutch Prime Minister Mark Rutte's center-right People's Party for Freedom and Democracy won the most seats, putting Mr. Rutte in a strong position to form a new ruling coalition. Preliminary results based on counting 94% of votes put the premier's center-right party on track to win 33 seats, an 8-seat drop compared with 2012 elections but still ahead of Mr. Wilders's group, which came second with 20 seats, followed closely by the conservative Christian Democratic Appeal and the centrist D66, both with 19 seats. Mr. Rutte late Wednesday held a victory speech to the cheers of a crowd gathered at The Hague's World Trade Center, saying his party's performance was a victory ""against the wrong sort of populism"" seen in the U.K. referendum to leave the European Union and the U.S. election. The outcome suggests that Dutch voters have elected a highly fragmented lower house of parliament, containing numerous midsize...","Islam , Muslims , Politics , Political parties , Presidential elections , Coalition governments , Aliens , Populism , Prime ministers , Immigration , Voter behavior , Italy , Turkey , Netherlands , Germany , France , Europe"
1868,3,0.998786567239288,1868,2016,1845974824,Europe's Left Loses Further Ground With Matteo Renzi's Resignation; Rejection of Italian reform package is latest instance in a broader downward slide for left-of-center parties across the continent,NA,NA
1886,3,0.9987600479139945,1886,2016,1846209238,Fate of E.U. in balance amid voter rebellion,"  The most disruptive shift in Europe next year could happen in France in May, when Le Pen, the leader of the National Front, is expected to make it to the second round of the presidential elections and could pull off an upset win.","Presidential elections , Candidates , International relations , EU membership , Leadership , Europe , Netherlands , Germany , France"
4877,3,0.9987295128327753,4877,2016,1817053990,Third-party contenders are wild cards,"  The new poll of voters in all 50 states revealed a variety of interesting dynamics across the country, including wide-ranging support for third-party candidates, the consistent role of President Obama's popularity and how Utah may be the most interesting state to watch this election.","Polls & surveys , Mormonism , Candidates , Third party , Idaho , Iowa , Utah , Colorado"
4839,3,0.99872666165858,4839,2016,1823528121,"Fifty-state poll: All eyes on third-party candidates, Obama's popularity -- and Utah (Posted 2016-09-05 21:58:06)","  The new poll of voters in all 50 states revealed a variety of interesting dynamics across the country, including wide-ranging support for third-party candidates, the consistent role of Obama's popularity and how Utah may be the most interesting state to watch this election.","Polls & surveys , Mormonism , Candidates , Third party , Idaho , Utah , Iowa , Colorado , Vermont"
8731,3,0.9987004185036695,8731,2017,1928142860,"In German Election Campaign, Third Place Is the Real Winner; Battle for bronze is likely to determine Angela Merkel's coalition partner and country's political direction for next four years",NA,"Conservatism , Local elections , Candidates , Coalition governments , Politics , Greece , United States--US , East Germany , Europe"
7161,3,0.9986944403460507,7161,2017,1895723590,"After Defeat, Marine Le Pen Emerges as Leader of French Opposition; Far-right candidate aims to impose herself as lead architect of a broader nationalist platform",NA,"Election results , Globalization , Presidential elections , Candidates , Voter behavior , Political parties , Trump, Donald J , United States--US , France , United Kingdom--UK , Europe"
7182,3,0.9986944403460507,7182,2017,1895884477,"After Defeat, Marine Le Pen Emerges as Leader of French Opposition; Far-right candidate aims to impose herself as lead architect of a broader nationalist platform",NA,"Election results , Globalization , Presidential elections , Candidates , Voter behavior , Political parties , Trump, Donald J , United States--US , France , United Kingdom--UK , Europe"
11312,3,0.9986412885458739,11312,2018,1986283189,ANALYSIS; A blue wave may be forming in West; Departure of Issa and Royce suggests Democrats' hopes for retaking Congress may begin in California.,NA,"Psychological aspects , Congressional elections , Political parties"
5684,3,0.9986314703664223,5684,2017,1884576744,"Europe's Nationalist Parties Are No Passing Fad; Antiestablishment parties are here to stay, whatever their setbacks this year in the Netherlands, France or Germany",NA,"Politics , Political parties , EU membership , Candidates , Aliens , Populism , Immigration , Trump, Donald J , Netherlands , United States--US , United Kingdom--UK , Macron, Emmanuel , Austria , France , Finland"
14683,3,0.9985361331934576,14683,2018,2058291511,Corey Stewart is the GOP Virginians wanted,"Minutes after Corey A. Stewart won Virginia's Republican primary for this year's U.S. Senate contest, fellow Republican Bill Bolling, twice elected lieutenant governor in an era in which Republicans were able to win statewide office, lamented on Twitter &#xa0;&#xa0;&#xa0;&#xa0; : ""I am extremely disappointed that a candidate like Corey Stewart could win the Republican nomination. This is clearly not the Republican Party I once knew, loved and proudly served. Every time I think things can't get worse they do, and there is no end in sight."" &#xa0;&#xa0;&#xa0;&#xa0; Just hours after Stewart won the Republican nomination, in a signal that should worry the Virginia GOP, two major sources of campaign funds - &#xa0;the Koch brothers-founded political action committee Americans for Prosperity and the National Republican Senatorial Committee &#xa0;&#xa0;&#xa0;&#xa0; - said they would not contribute to Stewart's campaign. &#xa0;&#xa0;&#xa0;&#xa0; Republican political strategist and former Virginia congressman Tom Davis told the New York Times that, for down-ticket Republican candidates this year, being asked whether they support Stewart is ""a killer"" issue among educated voters.","Nominations , Political parties , Political campaigns , Election results , Governors , Aliens , Congressional elections , Trump, Donald J , Virginia , Kaine, Tim , Stewart, Corey"
5449,3,0.9985092272129942,5449,2017,1881133640,"In Populists vs. Establishment, the Establishment Strikes Back; In elections in the Netherlands, Australia and Germany in recent days the forces of nationalism and populism suffered setbacks",NA,"Polls & surveys , Politics , Election results , EU membership , Presidential elections , Candidates , Nationalism , Prime ministers , Populism , Aliens , Immigration , Trump, Donald J , Western Australia Australia , Netherlands , Fillon, Francois , Germany , Turnbull, Malcolm , Merkel, Angela , France"
8738,3,0.9984853526074169,8738,2017,1928291375,World News: German Campaign Is All for Show,"Ms. Merkel's current government is a ""grand coalition"" bringing together Germany's two main political blocs -- her conservatives and Mr. Schulz's Social Democrats. The Greens want deeper EU integration, more resources for renewable energy and a more liberal refugee policy. If neither the Free Democrats nor the Greens do well enough to have a majority in parliament with Ms. Merkel's conservative bloc, she will be forced to decide between two less-palatable options: continuing her current grand coalition with the Social Democrats, or trying an unprecedented three-way coalition uniting her conservatives, the Greens and the Free Democrats.","Conservatism , Coalition governments , Elections , Germany , Merkel, Angela"
10375,3,0.9984772200612929,10375,2017,1961728225,A Mass Extinction for Virginia Republicans,NA,"Governors , State elections , Voter behavior , New Jersey , Murphy, Philip , Northam, Ralph"
8836,3,0.9984690050578793,8836,2017,1930217846,Numbers that add up to trouble for Virginia Republicans,NA,"Political campaigns , Population , Nominations , Governors , Candidates , Political parties , Garrison, William Lloyd"
10365,3,0.9984395367542984,10365,2017,1961581963,"A Mass Extinction for Virginia Republicans; Trump deflects blame, but the GOP lost because voters wanted to send him a message.",NA,"Nominations , Governors , Candidates , Voter behavior , McDonnell, Bob , Christie, Christopher J , New Jersey , Clinton, Hillary Rodham"
9535,3,0.9984221726241141,9535,2017,1940744342,A guide to Germany's election and why the U.S. should pay attention,NA,"Election results , School dropouts , Coalition governments , Parliaments , Political parties , United States--US , East Germany"
5472,3,0.9984133566099551,5472,2017,1881372679,U.S. News --- CAPITAL JOURNAL: Establishment Strikes Back in Recent Votes,"  It's too early to draw any definitive conclusions, and the biggest test comes next month in France's presidential vote. But in elections in the Netherlands, Australia and Germany in recent days, the forces of nationalism and populism that have been on the march across First World democracies suffered setbacks. The most recent test came over the weekend in Germany, where Chancellor Angela Merkel's ruling Christian Democratic Union struck a blow for the political establishment with a convincing victory in the state of Saarland, a good sign for the chancellor ahead of a national vote in September. The Christian Democrats' secretary-general, Peter Tauber, said voters had ""opted for stability and trustworthiness. . . . The CDU is the only force that has made clear it wouldn't work with either left- or right-wing populists.""","Nationalism , Populism , Elections , Europe , Australia"
316,3,0.9983954145835354,316,2016,1824803202,Election 2016: GOP State-Level Dominance Faces Test --- Democrats see chance to reduce Republicans' recent ascendancy in legislatures,  Some of those political and policy shifts now hang in the balance as Democrats build an oversize voter turnout operation to help presidential nominee Hillary Clinton in swing states such as Colorado and New Hampshire -- where GOP state legislative majorities are at risk.,"State elections , Political power , United States--US"
10025,3,0.998390855507164,10025,2017,1952768047,"Back on the Stump, Obama Calls on Voters to Reject 'Politics of Fear'; Former president campaigns for Democratic candidates for governor in New Jersey and Virginia",NA,"Political campaigns , State elections , Governors , Candidates , Trump, Donald J , Christie, Christopher J , United States--US , Kerry, John F , Gore, Albert Jr , Germany , New Jersey , Virginia , Biden, Joseph R Jr"
15689,3,0.9983723933728207,15689,2017,1874139168,"Get ready for your close-up, Virginia","Former Republican National Committee chairman Ed Gillespie, who demonstrated surprising strength by almost upsetting incumbent Democrat Mark R. Warner in Virginia's 2014 U.S. Senate race, was long viewed as the odds-on favorite for the GOP gubernatorial nomination. A consummate political insider, Gillespie kept his distance from Trump during the presidential campaign, and that doesn't sit well with Trump's supporters. [...]in early January, former congressman Tom Perriello announced his surprise candidacy for governor and set out...","Nominations , State elections , Colleges & universities , Governors , Presidential elections , Candidates , New Jersey , Potomac River , Virginia , Clinton, Hillary Rodham"
9681,3,0.9983043095078451,9681,2017,1943282895,"Political Disruption Helps Fuel GOP's Woes; Party leaders have themselves to blame, but they aren't alone among Western democracies",NA,"Political activism , Insurgency , Political leadership , Democracy , Populism , Trump, Donald J , Corker, Bob , United States--US , Tennessee , McConnell, Mitch , Alabama , Strange, Luther , Obama, Barack"
10374,3,0.9982135534141539,10374,2017,1961728219,U.S. News --- CAPITAL JOURNAL: Anti-Trump Coalition Takes Shape in Virginia,NA,"Generation Y , State elections , Voter behavior , Virginia"
584,4,0.9998282309171279,584,2016,1830028081,Religion events from around the Washington area (Posted 2016-10-14 21:52:25),"  St. John's Episcopal Church, Lafayette Square, Parish House, 1525 H St. NW. Autumn crafts and cookies, brownies, cake, pies, breads, hearty soups, gourds, mini-pumpkins and apple crisps will be available for sale.","Pumpkins , Episcopal churches , Congregational churches , Carnival of the Animals"
750,4,0.9997696660246025,750,2016,1831702289,Religion events from around the Washington area (Posted 2016-10-22 03:49:40),"  St. John's Episcopal Church, Lafayette Square, Parish House, 1525 H St. NW. There will be handmade quilts and crafts, homemade baked goods, children's activities, the St. Nicholas Attic, a book and CD table, raffled theme baskets, door prizes, a daily 50/50 raffle and a variety of vendors onsite.","Pumpkins , Episcopal churches , Methodist churches , Children & youth , Carnival of the Animals"
13589,4,0.9997266104968207,13589,2018,2031182449,"24 Famous Globe-Trotters on the Hotels They Love Most; Filmmakers, architects, designers, novelists and other demanding jet-setters share their favorite hotels, from Montana to the French Riviera",NA,"Families & family life , Design , Jewelry , Hotels & motels , Interior design , New York , Tomlin, Lily"
13588,4,0.9997252872110614,13588,2018,2031041252,"24 Famous Globetrotters on the Hotels They Love Most; Filmmakers, architects, designers, novelists and other demanding jet-setters share their favorite hotels, from Montana to the French Riviera",NA,"Families & family life , Design , Jewelry , Hotels & motels , Interior design , New York , Tomlin, Lily"
4668,4,0.9996587035522005,4668,2016,1814431965,Westchester,"  Film COLD SPRING Double Feature: ""Fantastic Mr. Fox"" (2009), animated film by Wes Anderson, starring George Clooney and Meryl Streep. Music and Dance BEACON Snehasish Mozumder and SOM (Sound of Mandolin), jazz.","Ice cream , Libraries , Music , Children & youth , Musicians & conductors , Singers , Hudson Valley , Costner, Kevin , Field, Sally , Clooney, George , Fishburne, Laurence , Streep, Meryl , Cave, Nick , Jeter, Derek , Van Dyke, Dick , Anderson, Wes , Reeves, Keanu , Moss, Carrie-Anne"
12957,4,0.999640538460473,12957,2018,2016367784,What to do this week in Chicago,NA,"Comedians , Comedies , Theater , Women , Audiences , Music festivals , Chicago Illinois , United States--US , Garofalo, Janeane"
12956,4,0.9996393963270247,12956,2018,2016367774,What to do this week in Chicago,NA,"Comedians , Comedies , Theater , Women , Audiences , Music festivals , Chicago Illinois , United States--US , Garofalo, Janeane"
9995,4,0.9995823373214786,9995,2017,1956444477,Going Italian,NA,"Pizza , Families & family life , Recipes , Neighborhoods , Gluten , Restaurants , Pasta , Italy , United States--US"
10376,4,0.9995593075684889,10376,2017,1961747318,Going Italian,NA,"Families & family life , Recipes , Neighborhoods , Gluten , Restaurants , Italy"
948,4,0.9995152593905329,948,2016,1836120580,"OFF DUTY --- Eating &amp; Drinking: Not Your Babushka's Kluski --- Fermented, foraged, whole-grain and invigoratingly herbal, the flavors of the moment are straight out of Central and Eastern Europe; Why does this old-world food seem so right-now?","  ""Because you can ask, 'What are real Polish ingredients?' And you realize that almost everything comes from somewhere else."" Ms. Pogrebinsky began tentatively peppering her seasonal-American fare with Slavic-accented specials like forest mushrooms slow-cooked with thick smetana cream, and to her delight those proved to be her menu's biggest hits.","Cooking , Recipes"
3603,4,0.9994839640603385,3603,2017,1864828146,"OFF DUTY --- Eating &amp; Drinking: How Pho Will You Go? --- You may know it as a beefy noodle soup, but why confine Vietnam's national dish to the same old bowl? With riffs on the recipe ranging from dumplings to burritos to cocktails, it's time to expand your pho-rizons","  Not long after that, in 1975, we immigrated to the States. Since there were no neighborhood pho shops in San Clemente, Calif., where we settled, the pho forays that followed were at home, often after Sunday mass, when our family assembled to slurp up my mother's beef or chicken pho. Over the years, I've taught hundreds of cooks of diverse backgrounds to prepare pho, and I guarantee that if you can boil water, you can master this dish. Since we just entered the Year of the Rooster, start by tackling the quick chicken pho recipe below, which employs standard supermarket ingredients to yield two satisfying servings in about 40 minutes.","Ethnic foods , Soups , Recipes"
10451,4,0.9993789029510073,10451,2017,1963849407,TRADITION with a few twists,NA,"Thanksgiving , Heat , Recipes , Sodium , Cookbooks , Carbohydrates , Vegetables , Cholesterol , Nutrition , Leaves , Proteins , Chicago Illinois"
12819,4,0.9993754899193175,12819,2018,2013491805,Heavenly treat,NA,"Vernal equinox , Milk , Fruits , Desserts , Italy , Sicily"
6762,4,0.9993368089196412,6762,2018,2076681646,Also Playing Prices are for the entire run of the show; individual shows might vary.,NA,"Tragedies , Dance , Cabaret , Comedies , Theater , Museums , Festivals , Entrepreneurs , Ireland , Chicago Illinois , Walker, Alice , Mussolini, Benito , Maryland , Schulz, Charles M (1922-2000) , Barrie, James M , Anderson, Marian , Connecticut , Evans, Moriah , Bernstein, Leonard , United States--US , New York , Einstein, Albert (1879-1955) , Alcott, Louisa May , Washington DC , Payton, Nova Y , Rosenblit, Jen , Delaware , Baum, L Frank"
6311,4,0.999312706965014,6311,2018,2065689388,"ART; THE WORLD CATCHES UP; She might be a hot discovery, but Luchita Hurtado was here all along",NA,"Artists , Modernism , Curators , Multiculturalism & pluralism , Photographers , Drawing , Museums , Painting , Art exhibits , Mexico , Los Angeles California , Hurtado, Luchita"
5434,4,0.9992885849489355,5434,2017,1944530919,MORE: INDIANA [Corrected 09/30/2017],NA,"Art galleries & museums , History , Students , Religious art , Shrines , Mascots , Museum exhibits , Donations , Public buildings , World War II , Families & family life , Library collections , Historic buildings & sites , Planetariums , United States--US"
5594,4,0.9991830974385427,5594,2017,1882893847,Classic Midwestern dishes,NA,"Pizza , Bakeries , Beef , Sandwiches , Recipes , High school basketball , Onions , Restaurants , Wisconsin , United States--US , Iowa , Des Moines Iowa"
14194,4,0.9991795538716121,14194,2018,2049476260,Calendar of Events,NA,"Musical theater , Performing arts centers , Cabaret , Comedies , Actors , Dramatists , Drama , Broadway theater , Cumming, Alan , Ireland , Chicago Illinois , Walker, Alice , Tannahill, Jordan , Georgia , Florida , Gardiner, Matthew , Anderson, Marian , Botticelli, Sandro (1444?-1510) , United States--US , Einstein, Albert (1879-1955) , Washington DC , Payton, Nova Y , Everglades , Shakespeare, William (1564-1616)"
8484,4,0.9991183654386228,8484,2017,1924316899,Regional food fuels road trip,NA,"Art galleries & museums , Crustaceans , Eggs , Photographs , Restaurants , Grand Canyon , Texas , Los Angeles California , United States--US , Maine , San Francisco California"
9599,4,0.998932635159858,9599,2017,1941905015,Relics of Padre Pio coming to Chicago,NA,"Catholic churches , Saints , Christianity , Catholicism , Chicago Illinois , United States--US"
