document,topic,gamma,document_number,year,StoreId,Title,Abstract,subjectTerms
9004,6,0.8678265094238274,9004,2017,1870269695,Flynn's Early Departure; A transcript of the weekend's program on FOX News Channel.,"A shake-up in the Trump White House this week with National Security Advisor Michael Flynn resigning after reports of the transcripts of his December phone calls with Russia's ambassador were leaked and contradicted his claims made to White House officials, including Vice President Mike Pence, that sanctions were not discussed. President Trump reacted to Flynn's ouster at a wild and wide-ranging press conference Thursday, defending his former national security advisor and condemning the leaks that led to his resignation. Gigot: Joining the panel this week, Wall Street Journal columnist and Deputy Editor, Dan Henninger; Editorial Board Member, Mary Kissel; and Assistant Editorial Page Editor, James Freeman. James Freeman: Well, I would say no based on the information we have to date. 70 years ago, President Truman signed the National Security Act preventing intelligence agencies from spying on Americans. Vice President Pence went on national television and told the nation that the issue of sanctions was not discussed between Gen. Flynn and the Russian ambassador and it's embarrassing to the vice president. [...]if you get to the point where your presidency is always being pushed back by anonymous stories and the sort of undulating wave of negativity like this, then your presidency starts to get into trouble. Kissel: Well, Paul, I am giving a hit to the Trump administration for reversing President Obama's policy of indulgence towards that criminal state to our south, Venezuela, and putting the vice president of Venezuela on the blacklist and bringing the wife of jailed opposition...","Press conferences , Resignations , Editorials , Political campaigns , Vice Presidents , Sanctions , Advisors , National security , Classified information , Russia , Pence, Mike"
8375,6,0.8676041494369799,8375,2016,1827382441,What Does Weld Say? Real-Time Reaction From a Libertarian,"  Joining us live during tonight's debate was William Weld, the Libertarian Party's vice-presidential nominee and a former two-term Republican governor of Massachusetts. [...]this year the Libertarian Party is going to be the comet that takes out the dinosaurs!"") Have things reached a point with Mr. Trump where that sort of plague-on-both-their-houses approach is dangerous? (Gary Johnson, your running mate, told The Wall Street Journal, ""That may be Bill's focus.","Nominations , Debates , Political campaigns , Presidential elections , Governors , United States--US , Clinton, Hillary , Trump, Donald J , Weld, William F"
9644,7,0.9993800967958201,9644,2017,1926835707,"Detention center roiled by attempts at suicide; Immigrants describe desperate conditions at Adelanto facility, leading to multiple hunger strikes.",NA,"Immigration policy , Complaints , Detention centers , Hunger strikes , Political asylum , Mens health , Gangs , Suicides & suicide attempts , United States--US"
8205,7,0.9990779903015011,8205,2016,1814431581,"A legal challenge for immigrants; Detainees seeking counsel are too easily taken advantage of by unscrupulous lawyers, advocates say.","  Sanchez traveled from his office in San Antonio to detention centers across the country to interview immigrants and accept payment, according to the Texas Attorney General's Office, which earlier this year secured an injunction barring him from advertising, performing or accepting money for immigration consulting services.","Attorneys , Detention centers , Immigration , Aliens"
7476,7,0.999042327365446,7476,2016,1764608992,Officer Is Convicted in Fatal Stairwell Shooting,"  A New York City police officer was convicted of manslaughter on Thursday for killing an unarmed man who was hit by a ricocheting bullet fired from the officer's gun in the stairwell of a Brooklyn housing project in a case that highlighted concerns over police accountability. The verdict, delivered in State Supreme Court in Brooklyn, comes amid a national debate on the policing of black neighborhoods after a string of killings of unarmed black men by police officers.","Manslaughter , State court decisions , Deadly force , Official misconduct , New York City New York , Liang, Peter , Gurley, Akai"
5637,7,0.998671442268052,5637,2014,1543394966,LAPD won't follow U.S. rules; The department will no longer heed immigration detention requests unless they're vetted by a judge.,  Many law enforcement agencies -- including the LAPD -- decided to reexamine their practices after an April federal court ruling found that an Oregon county was liable for damages after holding an inmate beyond her release date so she could be transferred to Immigration and Customs Enforcement.,"Aliens , Deportation , Law enforcement , Immigration policy , Los Angeles California"
4810,7,0.9985961108707803,4810,2013,1426455793,U.S. restricts detention site visits; ICE officials say the action will protect detainee privacy.,"  Federal officials have suspended volunteer visitation programs at three immigrant detention facilities in Southern California, sparking outcry from civil liberties groups who say the move further isolates detainees held out of sight, far from their families and often without access to legal aid.","Immigration policy , Endocrine therapy , Aliens , Transgender persons , Detention centers , Southern California"
7244,7,0.9984593803597893,7244,2015,1739351736,THE STATE; Plan for detainees scuttled; Transgender immigrants won't be sent to a facility in Adelanto.,"  Of the estimated 11 million people in the country illegally, more than 267,000 are lesbian, gay, bisexual or transgender, according to a 2013 report by the Williams Institute, a gender identity and sexual orientation think tank at UCLA.","Detention centers , Transgender persons , Gays & lesbians , Aliens , Activism , Immigration policy , Community support , Gender identity"
6789,7,0.9984076869822975,6789,2015,1701705594,"LOS ANGELES; Skid row shooting suit cites video, GQ","  Video from police body cameras disputes the Los Angeles Police Department's account of the fatal police shooting this year of an unarmed homeless man on downtown's skid row, according to a civil lawsuit filed Wednesday in L.A. Superior Court.","Litigation , Firearms"
654,7,0.9982982433717461,654,2008,433997464,Detention Center Facing Inquiry Will Get No More Immigrant Detainees,"Federal immigration officials said on Friday that they would place no more immigration detainees at a detention center in Rhode Island that is under investigation for its treatment of a Chinese computer engineer from New York who died in custody last summer, his body riddled with cancer and his spine broken.","Immigration , Fatalities , Prisoner treatment , Health care , Investigations , Aliens , Detention centers , Rhode Island"
4478,7,0.9982828493451055,4478,2013,1344934543,"In a First, Judge Orders Legal Aid for Mentally Disabled Immigrants Facing Deportation","  The federal government ""has long taken the position that it does not have to provide representation for anyone in immigration court and that has now been rejected by the court,"" said Ahilan Arulanantham of the American Civil Liberties Union Immigrants' Rights Project, one of the lawyers who brought the lawsuit.","Deportation , Aliens , Immigration policy , Court hearings & proceedings , Legal aid , Developmental disabilities , Mental disorders , California , United States--US"
3441,7,0.9981120636982436,3441,2012,967691950,"Family of a Murdered Immigrant Was in Crisis, Records Show","The search warrant affidavit, which was released by mistake to the Web site U-T San Diego on Wednesday and then to other media outlets on Thursday, revealed that the police obtained warrants to search the family's house and two cars, as well as their phones.","Divorce , Threats , Criminal investigations , Search warrants , Hate crimes , Murders & murder attempts , Muslim Americans , El Cajon California , Alawadi, Shaima"
3581,7,0.9977187949022828,3581,2012,1018205217,Drug cartels suspected in 5 Arizona desert deaths,"Four hours after the initial spotting by a Border Patrol agent, authorities found the smoldering wreckage of the Ford Expedition where it had gone off the road in the Vekol Valley.","Border patrol , Drug trafficking , Criminal investigations , Human trafficking , Fires , Aliens , Cartels , Human remains , Pinal County Arizona , Babeu, Paul"
3554,7,0.9973591049390772,3554,2012,1015212908,Mississippi Prison on Lockdown After Guard Dies,"All 2,542 of the prison's inmates are immigrants, from more than 70 countries, who are serving time for felonies before they are deported, said Steve Owen, a spokesman for the private company that operates the prison, the Corrections Corporation of America, of Nashville.","Prisoners , Prisons , Riots , Fatalities , Gangs , Natchez Mississippi"
2463,7,0.9971039236219981,2463,2011,856379484,"Cops, not immigration agents","About 60% of the 87,534 immigrants deported under the program had minor or no criminal convictions, according to the U.S. Department of Homeland Security's statistics, even though the program was aimed at dangerous criminals. [...] state and local law enforcement agencies are growing increasingly uneasy about participating in a program that they say thwarts their ability to work with communities with large immigrant populations.","Aliens , Immigration policy , Enforcement , Criminals , Deportation , Law enforcement , Police , Editorials -- Immigration policy , United States--US , California"
8585,7,0.9970437867245412,8585,2016,1840927868,U.S. starts releasing Haitian immigrants; More border crossings and a lack of jail space prompt officials to free migrants arriving from Mexico.,"  A surge in border crossings and a lack of immigration jail space have prompted the federal government to start releasing Haitian immigrants who have been entering the country in large numbers in recent months, backtracking on a pledge to jail them.","Aliens , Immigration policy , National security , United States--US , California , Arizona"
366,7,0.9948524158738657,366,2008,422198916,"Out of jail -- and out of the country; L.A. County expands its screening for illegal immigrants. More than 10,000 have already faced deportation.","Immigrant rights advocates criticize the screenings, saying that the sheriff's custody assistants are not adequately trained in complex immigration law and that there is room for error that has led to the deportation of at least one U.S. citizen. Supervisor Mike Antonovich said that even though immigration enforcement is a federal job, the county suffers the consequences of illegal immigrants' criminal activity and should do its part to help get them out of the U.S. ""We are paying the cost when they come over and commit crimes,"" said Antonovich, who voted for additional resources.","Immigration policy , Detention centers , Criminal records , Aliens , Prisoners , Deportation , Los Angeles California"
3303,7,0.9942843768899956,3303,2012,919810598,"CALIFORNIA BRIEFING; SANTA ANA; Ex-suspect held, then released","""ICE's case review showed Mr. Herrera had not had any prior immigration enforcement encounters, nor did he have a criminal history, aside from the charges which were just dismissed,"" according to a statement from immigration officials. --","Serial crime , Aliens , Immigration policy"
2000,7,0.9928305522195806,2e3,2010,749963450,"LAPD chief heckled at meeting over slaying; Beck promises a fair probe of Sunday's shooting in Westlake, but crowd is unruly.","With the knife recovered at the scene, eyewitness accounts allegedly supporting the authorities' claim that Jamines advanced aggressively toward the officers, and no racial overtones to the shooting, the incident did not seem to be one that would cause such an eruption of anger. The area's large population of immigrant day laborers, who have struggled to find work during the city's financial collapse and have grown frustrated with the LAPD's aggressive stance against the neighborhood's ubiquitous illegal street vendors, may have been particularly receptive to the calls for upheaval, Beck said.","Shootings , Meetings , Police administration , Crowd control , Deadly force , Demonstrations & protests -- Los Angeles California , Community relations , Los Angeles California , Beck, Charles L (Charlie)"
275,7,0.9914492500391482,275,2008,422240662,The road back to Mexico stops 100 yards short,"Illegal immigrants became targets for arrest at the checkpoints only a few months ago, according to immigrant rights groups and human rights organizations in Mexico.","Aliens , Law enforcement , Border patrol , Immigration policy , Criminal records , Mexico , San Diego California"
5871,7,0.9897753209897521,5871,2014,1566973901,City Proposal Would Limit Detention of Migrants,"  Under the legislation, to be introduced next week by the City Council speaker, Melissa Mark-Viverito, the Correction Department would be prohibited from using resources to help enforce civil immigration laws ""unless it is in furtherance of honoring a valid detainer request,"" according to Ms. Mark-Viverito's office.","Aliens , Deportation , Cities , Legislation , Federal state relations , New York City New York , United States--US"
183,7,0.9885591548076741,183,2008,433806470,Gang Fights In Prison Injure 22 And Kill One,"The fights, which broke out about 6:20 a.m., were quelled with the help of 10 nonguards -- plumbers, electricians, secretaries and other workers -- who happened to be reporting early, said Richard Wechsler, local president of the American Federation of Government Employees, a supervisor and a former guard at the prison.","Detention centers , Gangs , Injuries , Fatalities , Prisoners , Houston Texas"
1858,7,0.987042141782722,1858,2010,734368173,Arizona Law Needs U.S. Cooperation,"While local police can arrest illegal immigrants, only the federal government can deport them. Because the federal immigration-enforcement agency has suggested it won't necessarily cooperate in helping meet the law's goal, local police could be forced to choose between holding detainees in their own jails or releasing them.","Aliens , Immigration policy , Deportation , State laws , Enforcement , United States--US"
1861,7,0.9865069331681021,1861,2010,732523921,U.S. News: Arizona Law Needs U.S. Cooperation,"While local police can arrest illegal immigrants, only the federal government can deport them. Because the federal immigration-enforcement agency has suggested it won't necessarily cooperate in helping meet the law's goal, local police could be forced to choose between holding detainees in their own jails or releasing them.","Aliens , Deportation , State laws , Law enforcement , Immigration policy , Federal state relations , United States--US , Arizona"
2393,7,0.9858117995546495,2393,2011,849298583,"U.S., city team up to oust illegal immigrants","Most arrests are of illegal immigrants with deportation orders and drunk-driving records, but gang members and sex and drug offenders have also been snared and deported. Since the pair of ICE agents moved into police headquarters, the pilot program, which was recently made permanent, has been hailed by many as a welcome expansion of federal authority.","Aliens , Law enforcement , Criminals , Deportation , Immigration policy , United States--US , Mexico"
9152,7,0.985446298174109,9152,2017,1878075957,Court arrests by ICE raise alarm; Lawyers say the tactic will deter people in the U.S. illegally from testifying or seeking restraining orders.,"[...]activists, attorneys and prosecutors fear ICE's increased presence in courthouses could deter other immigrants without legal status from appearing in court to testify as witnesses or answer warrants, which ultimately could endanger prosecutions. ICE has made arrests in courthouses before, but the tactic drew rebukes in California after a series of raids led to the capture of women seeking restraining orders, people paying parking tickets and even one couple getting married inside a Kern County courthouse in 2013, according to the American Civil Liberties Union. Last week, Denver City Atty. Kristin Bronson also told several media outlets that she had to dismiss prosecutions against four domestic violence suspects because the complaining witnesses, all of whom are in the country illegally, were afraid ICE might learn their location through a court docket or send agents to the courthouse when they appeared to testify. Some law enforcement leaders in California and throughout the country have repeatedly expressed concern that Trump's promise to dramatically expand immigration enforcement will erode trust between minority communities and local police departments, a bond already weakened by years of scrutiny over officers' use of force throughout the country. ICE faced renewed scrutiny last month after the agency released a video showing immigration agents identifying themselves as police, a tactic decried by activists as unethical and police leaders as detrimental to local law enforcement's relationship with immigrant communities.","Immigration policy , Deportation , Activists , Law enforcement , Public safety , Restraining orders , Convictions , Women , Sex crimes , Courthouses , Aliens , Texas , John F. Kelly , United States--US , Southern California , Arizona , Sessions, Jeff , Colorado , Los Angeles County California , California , Cantil-Sakauye, Tani"
1862,7,0.9842556440489102,1862,2010,732576102,City News: Attacks Prompt Added Port Richmond Patrols,New York police are stepping up their presence in the Staten Island neighborhood of Port Richmond amid an escalation of bias crimes against the Latino population.,"Hispanics , Police , Hate crimes , Crime prevention , Port Richmond-Staten Island NY"
4907,7,0.9839975958616751,4907,2013,1437409519,"Beck rescinds vehicle impound policy; To comply with a judge's order, LAPD chief reluctantly shelves rule benefiting some immigrants without licenses.","  Under the terms of Special Order 7, if officers stopped an unlicensed driver who met several requirements -- including having auto insurance, valid identification and no previous citations for unlicensed driving -- officers could no longer invoke the part of the state vehicle code that allowed them to confiscate the vehicle for 30 days, a punishment that came with fines and charges often exceeding $1,200.","State court decisions , State laws , Rules , Confiscation , Immigration policy , Los Angeles California , Beck, Charles L (Charlie)"
1656,7,0.983576184842814,1656,2010,237996806,The Police and Immigration: New York's Experience; A spouse may be reluctant to report abuse if she fears that the consequence will be deportation for the father of her children.,"The issuance of immigration detainers also discourages inmates from posting bail, even when they can afford to do so, because inmates subject to detainers who succeed in posting bail are transferred directly into federal immigration custody. [...] the city also bears the expense of housing those inmates who would otherwise be out on bail.","Immigration policy , Aliens"
9009,7,0.9835281959432413,9009,2017,1870485207,Ruses by immigration agents come under fire; Posing as local police raises legal and ethical questions,"[...]it has reignited long-simmering objections from immigrant rights attorneys and advocates, who say the scene illustrates unethical -- and, in some cases, illegal -- ruses ICE agents have used for years, portraying themselves as officers from local police departments to ensnare people or fool them into revealing the whereabouts of family members. The use of the tactic, critics said, is particularly egregious in heavily immigrant cities such as Los Angeles and San Francisco, where police and elected officials have tried for decades to distinguish their cops from federal immigration agents in an effort to convince immigrants living illegally in their cities that they can interact with local police without fear of deportation. ""There is something fundamentally unfair about ICE exploiting local and state policies that are trying to improve public safety by promoting immigrants' trust in law enforcement,"" said Frances Miriam Kreimer, senior attorney at Dolores Street Community Services in San Francisco. In one case, ICE agents in Los Angeles identified themselves as police detectives to the mother of Luis Enrique Cruz Estrada, saying her son had information regarding the whereabouts of a person they wanted to find, according to attorney Jennie Pasquarella, director of immigrants' rights for the American Civil Liberties Union of California. In Los Angeles, where a recent Pew study estimated the population of people in the country illegally at 375,000, Police Chief Charlie Beck and Mayor Eric Garcetti have gone to significant lengths to advocate for the rights of immigrants and distance the LAPD's work from...","Immigration policy , Deportation , Criminal investigations , Law enforcement , Arrest warrants , Aliens , Los Angeles California , San Francisco California"
415,7,0.9834457783869434,415,2008,433887728,Group Calls For Inquiry Into Death Of Detainee,"""Lack of access to adequate medical care is among detainees' chief complaints,"" said the center's executive director, Cheryl Little, an immigration lawyer.","Detention centers , Aliens , Fatalities , Health care access , Florida , Joseph, Valery"
1863,7,0.9823222004138373,1863,2010,734368331,Attacks Prompt Added Port Richmond Patrols,NA,NA
51,8,0.9992097730553783,51,2008,422172701,"CAMPAIGN '08: SUPER TUESDAY; Obama's next step an uphill climb; On Super Tuesday, his key rival, Clinton, has the advantage in the largest states. Charm may not save him.","Twenty-two states hold Democratic primaries or caucuses that day, spanning political terrain from California to Massachusetts, from Latino communities in the West to majority-black cities in the East, a mix of states that includes some of the nation's most expensive television advertising markets. Kennedy, the Massachusetts senator and one of the Democratic Party's most senior figures, will campaign for Obama and help him shore up support among Latino voters, said someone close to the endorsement announcement.","Nominations , African Americans , Candidates , Press conferences , Political campaigns , Endorsements , Presidential elections , Primaries & caucuses , California , South Carolina , Obama, Barack"
4018,8,0.9992064695783736,4018,2012,1138365787,Republicans Expect to Retain House,"  The election could be even more problematic for House Minority Leader Nancy Pelosi, the former speaker, particularly if Democratic candidates underperform. Republicans also scored more advantages than Democrats from the once-a-decade process of redistricting in many states, thanks to large gains the party scored in state legislatures in 2010.","Health care policy , Political campaigns , Political parties , Bills , California , Obama, Barack , Pelosi, Nancy , Boehner, John"
82,8,0.9991366963487455,82,2008,433792460,"With Issues of War and Peace on Their Minds, Voters Make Choices","Mitt Romney won in his home state, with both the party faithful and independents flocking to his side, according to exit polling. Mr. Romney, a former Massachusetts governor, matched Senator John McCain in attracting voters who identified themselves as moderate and took the vast majority of those who identified themselves as conservative. Mr. McCain surprised many by making a campaign stop in Boston on Sunday, where he watched the Super Bowl in a hotel lobby. Polls showed the contest tightening, and Mr. McCain told audiences that he believed he had a chance of winning the state's 43 delegates. Mr. Mc- Cain won the primary in 2000, defeating George W. Bush by nearly two to one. But Mr. Romney dismissed the 11th hour visit by Mr. Mc- Cain, saying, ''I've got a lot of friends there.'' Many observers had said that if Mr. Romney lost his home state, it would signal the end of the campaign. Although state officials had said they expected a record turnout, rain throughout the day seemed to temper that. Mr. McCain's effort to court conservative Republicans helped him win in Illinois, where nearly 4 in 10 primary voters who described themselves as conservatives said they had voted for him, according to early exit polls. Mr. Romney, who had argued that a vote for Mr. McCain represented an abandonment of the party's conservative principles, won slightly fewer votes among conservatives, the exit polls showed. Earlier polls had shown Mr. McCain with a strong lead in Illinois, a state with an open primary and 70 delegates at stake. As was the case elsewhere, Republican primary voters polled here were far less concerned about immigration than about the economy. Although Mr. Romney argued that his business career better prepared him to manage the nation's fiscal matters, voters who cited the economy as their major concern chose Mr. Mc- Cain. Overwhelmingly, voters surveyed in Illinois said that Mr. McCain was more qualified than any of his competitors to be commander in chief.","Presidential elections , Political campaigns , Primaries & caucuses , Romney, W Mitt , McCain, John , Huckabee, Mike"
3970,8,0.9991314293648085,3970,2012,1113982692,"Dead Heat for Romney, Obama --- WSJ/NBC Poll Shows GOP Contender Gains; Obama Retains Lead Among Women","  Mitt Romney has strengthened his image as the candidate best able to boost the economy and has fought President Barack Obama to a near-draw on who can best serve as commander in chief, helping turn the 2012 election into a tie among likely voters, a new nationwide poll shows.","Polls & surveys , Candidates , Voter behavior , Journals , Presidential elections , United States--US , Obama, Barack , Kerry, John F , Bush, George W , Obama, Barack , Romney, W Mitt"
